{
  "schema_version": "0.1",
  "contract_status": "draft",
  "robot_id": "research-unit-01",
  "sensor_id": "audio-unverified-01",
  "captured_at": "2099-01-01T00:00:00Z",
  "sequence": 0,
  "timestamp_source": "unknown",
  "content_type": "audio/unknown",
  "encoding": null,
  "sample_rate_hz": null,
  "channels": null,
  "chunk_duration_ms": null,
  "verification_status": "unverified",
  "transport": {
    "type": "object_storage",
    "reference": "object:00000000-0000-4000-8000-000000000002",
    "expires_at": "2099-01-01T00:01:00Z"
  }
}
